{"$id":"urn:acme-firm:schema:provenance:0.2.0","$schema":"https://json-schema.org/draft/2020-12/schema","additionalProperties":false,"description":"Contrato estructural del registro canónico. Las unicidades, referencias, estados de materialización y fronteras de evidencia se verifican además mediante scripts/validate_derivation_ledger.py.","properties":{"$schema":{"const":"schemas/provenance.schema.json","type":"string"},"artifact_set":{"type":"array"},"change_control":{"type":"object"},"claim_provenance_classes":{"type":"object"},"decisions":{"items":{"additionalProperties":false,"properties":{"approval_basis":{"type":"string"},"approval_record":{"type":"object"},"approved_at":{"pattern":"^[0-9]{4}-[0-9]{2}-[0-9]{2}$","type":"string"},"claim_provenance_class":{"minLength":1,"type":"string"},"condition_or_route":{"type":"string"},"decision":{},"id":{"pattern":"^T(?:0[0-9]|1[0-7])-[A-Z0-9-]+$","type":"string"},"interpretation":{"type":"string"},"semantic_amendment":{"type":"object"},"source_refs":{"items":{"type":"object"},"type":"array"},"status":{"minLength":1,"type":"string"},"subject":{"minLength":1,"type":"string"}},"required":["id","subject","status","approved_at","claim_provenance_class","decision"],"type":"object"},"minItems":1,"type":"array"},"document":{"additionalProperties":false,"properties":{"created_at_utc":{"pattern":"^[0-9]{4}-(?:0[1-9]|1[0-2])-(?:0[1-9]|[12][0-9]|3[01])T(?:[01][0-9]|2[0-3]):[0-5][0-9]:[0-5][0-9](?:\\.[0-9]+)?Z$","type":"string"},"id":{"const":"IFATIGUE-INFRA6-M6-PROVENANCE","type":"string"},"language":{"const":"es","type":"string"},"origin_class":{"const":"generated_for_doctoral_instance","type":"string"},"self_hash":{"type":"null"},"self_hash_policy":{"minLength":1,"type":"string"},"status":{"const":"candidate_under_construction","type":"string"},"title":{"minLength":1,"type":"string"},"updated_at_utc":{"pattern":"^[0-9]{4}-(?:0[1-9]|1[0-2])-(?:0[1-9]|[12][0-9]|3[01])T(?:[01][0-9]|2[0-3]):[0-5][0-9]:[0-5][0-9](?:\\.[0-9]+)?Z$","type":"string"}},"required":["created_at_utc","id","language","origin_class","self_hash","self_hash_policy","status","title","updated_at_utc"],"type":"object"},"engineering_reproducibility_profile":{"type":"object"},"evidence_boundary":{"type":"object"},"external_distribution_tree":{"type":"array"},"file_origin_classes":{"type":"object"},"historical_antecedent":{"type":"object"},"open_decisions":{"type":"array"},"package_identity":{"additionalProperties":false,"properties":{"artifact_version_policy":{"type":"object"},"conceptual_id":{"const":"IFATIGUE-INFRA6-M6","type":"string"},"construction_started_at_utc":{"pattern":"^[0-9]{4}-(?:0[1-9]|1[0-2])-(?:0[1-9]|[12][0-9]|3[01])T(?:[01][0-9]|2[0-3]):[0-5][0-9]:[0-5][0-9](?:\\.[0-9]+)?Z$","type":"string"},"materialization_status":{"minLength":1,"type":"string"},"package_version":{"const":"1.1.0","type":"string"},"planned_archive":{"minLength":1,"type":"string"},"release_stage":{"const":"candidate","type":"string"},"root_directory":{"const":"IFATIGUE-INFRA6-M6-v1.1.0/","type":"string"},"verification_status":{"minLength":1,"type":"string"}},"required":["artifact_version_policy","conceptual_id","construction_started_at_utc","materialization_status","package_version","planned_archive","release_stage","root_directory","verification_status"],"type":"object"},"planned_file_sets":{"type":"array"},"planned_tree":{"items":{"additionalProperties":false,"properties":{"function":{"minLength":1,"type":"string"},"generated_by":{"minLength":1,"type":"string"},"origin_class":{"minLength":1,"type":"string"},"path":{"pattern":"^(?!/)(?!.*(?:^|/)\\.\\.(?:/|$))[A-Za-z0-9_.-]+(?:/[A-Za-z0-9_.-]+)*$","type":"string"},"status":{"minLength":1,"type":"string"}},"required":["path","function","origin_class","status"],"type":"object"},"minItems":1,"type":"array"},"relationships":{"type":"array"},"responsibility":{"type":"object"},"schema_resolution_status":{"minLength":1,"type":"string"},"schema_version":{"const":"0.2.0","type":"string"},"scientific_boundary":{"type":"object"},"scientific_claims":{"items":{"additionalProperties":false,"properties":{"claim_id":{"pattern":"^(?:CLM|REQ|LIM)-[A-Z0-9-]+$","type":"string"},"claim_provenance_class":{"minLength":1,"type":"string"},"failure_condition":{"type":"string"},"source_lexeme":{"type":"string"},"source_refs":{"items":{"type":"object"},"type":"array"},"statement":{"minLength":1,"type":"string"},"transformation":{"minLength":1,"type":"string"},"value":{}},"required":["claim_id","claim_provenance_class","statement","source_refs","transformation"],"type":"object"},"minItems":1,"type":"array"},"sources":{"type":"array"},"unavailable_sources":{"type":"array"}},"required":["$schema","artifact_set","change_control","claim_provenance_classes","decisions","document","engineering_reproducibility_profile","evidence_boundary","external_distribution_tree","file_origin_classes","historical_antecedent","open_decisions","package_identity","planned_file_sets","planned_tree","relationships","responsibility","schema_resolution_status","schema_version","scientific_boundary","scientific_claims","sources","unavailable_sources"],"title":"IFATIGUE-INFRA6-M6 provenance contract","type":"object"}
