{"$schema":"schemas/provenance.schema.json","artifact_set":["artifacts/01_PF-FAT-1.0.0.md","artifacts/02_PA-INFRA6-1.0.0.md","artifacts/03_MFV-FAT-COP-1.0.0.md","artifacts/04_MI-FAT-COP-1.0.0.md","artifacts/05_MOD-FAT-COP-1.0.0_IF-GA-EF-1.0.0.md","artifacts/06_CI-FAT-INFRA6-1.0.0.md","artifacts/07_ME-FAT-INFRA6-1.0.0.md"],"change_control":{"generated_outputs_manual_editing":"prohibited","granular_field_or_section_provenance_required":true,"hash_does_not_mean":["autoría intelectual","autenticidad editorial","licencia de uso o redistribución","validación científica"],"hash_means":"integridad de una copia concreta","no_retrodating":true,"oracle_independence":"Los oráculos no importarán ni replicarán ciegamente la función bajo prueba.","release_blockers":["fixtures o resultados sin etiqueta sintética","GEA utilizado en construcción, calibración o pruebas","archivos híbridos sin procedencia granular","salidas generadas editadas manualmente","afirmaciones empíricas o clínicas no sustentadas","ausencia de límites científicos, éticos o de reproducibilidad","cambio de especificación motivado por el resultado de la prueba"],"scenario_freeze":"Los escenarios y oráculos se fijarán antes de implementar el código y no se adaptarán a posteriori para obtener resultados favorables."},"claim_provenance_classes":{"doctoral_inference":"Inferencia doctoral: interpretación o síntesis argumentada por la tesis, separada de la formulación de la fuente.","excluded_from_execution":"Excluido de la ejecución: material histórico o contextual que no participa en construcción, calibración, pruebas ni resultados.","explicit_source":"Fuente explícita: contenido localizable de forma precisa en una fuente primaria disponible.","generated_for_doctoral_instance":"Generado para la instancia doctoral: decisión, especificación, software o evidencia construida durante T03 o T04.","pending_verification":"Pendiente de verificación: afirmación o recurso cuya corroboración material todavía no es posible."},"decisions":[{"approval_basis":"T01-AF-032","approval_record":{"localizer":"sección 4, fila T01-AF-002","path":"output/t01/REGISTRO_UNICO_DECISIONES_Y_CIERRE_T01.md","sha256":"e03d051e11181b944e079d4201db606da297873944f73eea376b13380b809c03","source_id":"REC-T01-CLOSURE"},"approved_at":"2026-09-03","claim_provenance_class":"generated_for_doctoral_instance","condition_or_route":"Aplicación textual transversal; resultados solo en T14.","decision":"F5 podrá aportar únicamente A1 y A3 en las dimensiones examinadas; no A2 ni A5.","id":"T01-AF-002","status":"imported_approved_decision","subject":"Alcance posible de F5"},{"approval_basis":"T01-AF-032","approval_record":{"localizer":"sección 4, fila T01-AF-008","path":"output/t01/REGISTRO_UNICO_DECISIONES_Y_CIERRE_T01.md","sha256":"e03d051e11181b944e079d4201db606da297873944f73eea376b13380b809c03","source_id":"REC-T01-CLOSURE"},"approved_at":"2026-09-03","claim_provenance_class":"generated_for_doctoral_instance","condition_or_route":"§5.7.1 y metodología dependiente.","decision":"Normalizar Expectation como Expectedness y Goal Orientation como Goal Conduciveness; no se añaden variables ni se alteran funciones.","id":"T01-AF-008","status":"imported_approved_decision","subject":"Normalización terminológica de F6"},{"approval_basis":"T01-AF-032","approval_record":{"localizer":"sección 4, fila T01-AF-011","path":"output/t01/REGISTRO_UNICO_DECISIONES_Y_CIERRE_T01.md","sha256":"e03d051e11181b944e079d4201db606da297873944f73eea376b13380b809c03","source_id":"REC-T01-CLOSURE"},"approved_at":"2026-09-03","claim_provenance_class":"generated_for_doctoral_instance","condition_or_route":"§5.7.1.","decision":"F6 representa la interfaz de salida de General Appraisal mediante un vector versionado; no reproduce su cálculo psicológico ni su código completo.","id":"T01-AF-011","status":"imported_approved_decision","subject":"Frontera de la interfaz General Appraisal"},{"approval_basis":"T01-AF-032","approval_record":{"localizer":"sección 4, fila T01-AF-012","path":"output/t01/REGISTRO_UNICO_DECISIONES_Y_CIERRE_T01.md","sha256":"e03d051e11181b944e079d4201db606da297873944f73eea376b13380b809c03","source_id":"REC-T01-CLOSURE"},"approved_at":"2026-09-03","claim_provenance_class":"generated_for_doctoral_instance","condition_or_route":"§5.7.2; no usar GEA para calibrar fatiga-Coping Potential.","decision":"GEA se conserva como referencia histórica del estudio de 2019; mientras el archivo exacto esté ausente no se afirma una auditoría directa, 37 columnas ni dimensiones completas.","id":"T01-AF-012","status":"imported_approved_decision","subject":"Uso permitido de GEA"},{"approval_basis":"T01-AF-032","approval_record":{"localizer":"sección 4, fila T01-AF-015","path":"output/t01/REGISTRO_UNICO_DECISIONES_Y_CIERRE_T01.md","sha256":"e03d051e11181b944e079d4201db606da297873944f73eea376b13380b809c03","source_id":"REC-T01-CLOSURE"},"approved_at":"2026-09-03","claim_provenance_class":"generated_for_doctoral_instance","condition_or_route":"Tabla 5.13.","decision":"Aclarar que existen 15 trazas SHA-256 de modulación y que el rechazo previo de S15 se registra por separado en la matriz.","id":"T01-AF-015","status":"imported_approved_decision","subject":"Conteo de trazas y rechazo S15"},{"approval_basis":"T01-AF-032","approval_record":{"localizer":"sección 4, fila T01-AF-016","path":"output/t01/REGISTRO_UNICO_DECISIONES_Y_CIERRE_T01.md","sha256":"e03d051e11181b944e079d4201db606da297873944f73eea376b13380b809c03","source_id":"REC-T01-CLOSURE"},"approved_at":"2026-09-03","claim_provenance_class":"generated_for_doctoral_instance","condition_or_route":"§5.7.6.","decision":"Eliminar la cifra de 44.766 microsegundos por invocación porque carece de protocolo reproducible de benchmark.","id":"T01-AF-016","status":"imported_approved_decision","subject":"Retiro de cifra de rendimiento no reproducible"},{"approval_basis":"T01-AF-032","approval_record":{"localizer":"sección 4, fila T01-AF-021","path":"output/t01/REGISTRO_UNICO_DECISIONES_Y_CIERRE_T01.md","sha256":"e03d051e11181b944e079d4201db606da297873944f73eea376b13380b809c03","source_id":"REC-T01-CLOSURE"},"approved_at":"2026-09-03","claim_provenance_class":"generated_for_doctoral_instance","condition_or_route":"T02-T04 y conclusiones.","decision":"Anclar toda inferencia de F6 al caso, la versión y la topología declarados. F6 identifica la instancia actual; episodios externos futuros constituirán evidencia nueva.","id":"T01-AF-021","status":"imported_approved_decision","subject":"Límite de inferencia de F6"},{"approval_basis":"T01-AF-032","approval_record":{"localizer":"sección 4, fila T01-AF-022","path":"output/t01/REGISTRO_UNICO_DECISIONES_Y_CIERRE_T01.md","sha256":"e03d051e11181b944e079d4201db606da297873944f73eea376b13380b809c03","source_id":"REC-T01-CLOSURE"},"approved_at":"2026-09-03","claim_provenance_class":"generated_for_doctoral_instance","condition_or_route":"§3.12, §5.6 y síntesis dependientes.","decision":"Recalibrar F3 según las fuentes primarias: 2017 dejó problemas abiertos; 2018b aporta esquema, pseudocódigo y caso hipotético; 2019 es prueba de concepto mixta. F3 es principalmente A2, con A3 parcial, y no A4.","id":"T01-AF-022","status":"imported_approved_decision","subject":"Recalibración del alcance de F3"},{"approval_basis":"T01-AF-032","approval_record":{"localizer":"sección 4, fila T01-AF-023","path":"output/t01/REGISTRO_UNICO_DECISIONES_Y_CIERRE_T01.md","sha256":"e03d051e11181b944e079d4201db606da297873944f73eea376b13380b809c03","source_id":"REC-T01-CLOSURE"},"approved_at":"2026-09-03","claim_provenance_class":"generated_for_doctoral_instance","condition_or_route":"Capítulos 3, 5 y 6.","decision":"Uniformar F4 como A3 y A4-ilustrativo: recorrido integrador inicial, no aplicación operacional. Los resultados o artefactos ausentes se atribuyen como reportados, no como verificados.","id":"T01-AF-023","status":"imported_approved_decision","subject":"Alcance de F4"},{"approval_basis":"T01-AF-032","approval_record":{"localizer":"sección 4, fila T01-AF-028","path":"output/t01/REGISTRO_UNICO_DECISIONES_Y_CIERRE_T01.md","sha256":"e03d051e11181b944e079d4201db606da297873944f73eea376b13380b809c03","source_id":"REC-T01-CLOSURE"},"approved_at":"2026-09-03","claim_provenance_class":"generated_for_doctoral_instance","condition_or_route":"§3.12, §6.6 y trabajo futuro.","decision":"A5 permanece ausente; los estudios futuros solo podrían aportar A5 según diseño, ejecución y resultados.","id":"T01-AF-028","status":"imported_approved_decision","subject":"Ausencia de A5"},{"approval_basis":"T01-AF-032","approval_record":{"localizer":"sección 4, fila T01-AF-029","path":"output/t01/REGISTRO_UNICO_DECISIONES_Y_CIERRE_T01.md","sha256":"e03d051e11181b944e079d4201db606da297873944f73eea376b13380b809c03","source_id":"REC-T01-CLOSURE"},"approved_at":"2026-09-03","claim_provenance_class":"generated_for_doctoral_instance","condition_or_route":"§§5.5, 6.1 y dependencias.","decision":"Identificar M0-M6 como definición normativa interna de ACME-FIRM, no como certificación externa ni logro verificado por definición.","id":"T01-AF-029","status":"imported_approved_decision","subject":"Carácter normativo interno de M0-M6"},{"approved_at":"2026-09-04","claim_provenance_class":"generated_for_doctoral_instance","decision":"Conservar IFATIGUE-INFRA6-M6 como identificador conceptual y construir un paquete nuevo 1.1.0 con fecha, procedencia y hashes reales.","id":"T03-PR-001","source_refs":[{"localizer":"sección 12, decisión T03-PR-001","source_id":"REC-T02-AUDIT"}],"status":"approved_by_author","subject":"Identidad y versión de la reconstrucción"},{"approved_at":"2026-09-04","claim_provenance_class":"generated_for_doctoral_instance","decision":"Mantener los identificadores internos 1.0.0 declarados por la tesis; será su primera materialización materialmente verificable solo si T03 se completa y T04 supera la reproducción limpia.","id":"T03-AV-002","status":"approved_under_standing_authorization","subject":"Versiones internas de los siet